{
  "unit_id": "finance-cell",
  "owner": "finance-team",
  "description": "Finance departmental cell — compute contract kernel, execution gateway, admission/quota/lease manager.",
  "constituent_components": ["CMP-CTL-001-compute-contract-kernel","CMP-CTL-002-execution-gateway","CMP-RES-007-admission-quota-and-lease-manager"],
  "artifact": {
    "coordinates": "local://finance-cell",
    "digest": null,
    "status": "declared-not-built"
  },
  "contract_versions": {
    "common-envelope": "asf.common.envelope.v1",
    "execution-order": "asf.gov.execution_order.v1",
    "execution-result": "asf.cmp.execution_result.v1"
  },
  "state_owners": ["GOV-KRN-001-governance-object-model-and-registry","GOV-IAM-003-authorization-decision-engine"],
  "dependencies": ["governance-cell"],
  "placement": "departmental-cpu",
  "rollout_policy": "staged",
  "profile_bindings": ["enterprise-multidepartment"],
  "health_checks": {
    "readiness": "/healthz",
    "liveness": "/livez"
  },
  "resource_limits": {
    "cpu_cores": 2,
    "memory_gb": 4
  },
  "secrets": [],
  "migrations": []
}
