{
  "unit_id": "logistics-cell",
  "owner": "logistics-team",
  "description": "Logistics departmental cell \u2014 compute contract kernel, execution gateway, data staging and result collection.",
  "constituent_components": [
    "CMP-CTL-001-compute-contract-kernel",
    "CMP-CTL-002-execution-gateway",
    "CMP-DAT-001-data-staging-and-result-collection"
  ],
  "artifact": {
    "coordinates": "local://logistics-cell",
    "digest": null,
    "status": "declared-not-built"
  },
  "contract_versions": {
    "common-envelope": "asf.common.envelope.v1",
    "execution-order": "asf.gov.execution_order.v1",
    "execution-result": "asf.cmp.execution_result.v1"
  },
  "state_owners": [
    "CMP-DAT-001-data-staging-and-result-collection"
  ],
  "dependencies": [
    "governance-cell"
  ],
  "placement": "enterprise-multidepartment",
  "rollout_policy": "staged",
  "profile_bindings": [
    "enterprise-multidepartment"
  ],
  "health_checks": {
    "readiness": "/healthz",
    "liveness": "/livez"
  },
  "resource_limits": {
    "cpu_cores": 2,
    "memory_gb": 4
  },
  "secrets": [],
  "migrations": []
}
